{
  "settingId": "spuk_im_schlosskeller",
  "hinweis": "Die neun Entscheidungen des Detektivs (E-024). Eine Option deckt Fakten auf; ein Fakt erscheint in einem Pfad nur, wenn seine Quelle dort entsteht (Beobachtung mit pfade, Spur mit entstehtWenn). Sonst zeigt die Option die harmlose Fassung der Spur. Die Restverdächtigen folgen allein aus den Regeln und den aufgedeckten Fakten; Bonus-Hinweise zählen nicht (W-1).",
  "regeln": [
    {
      "id": "R-ENTLASTET",
      "wenn": [
        "alibi",
        "nebendelikt"
      ],
      "folge": "entlastet",
      "text": "Wer beim Scheppern nachweislich woanders war und wessen Heimlichtuerei belegt ist, scheidet aus."
    },
    {
      "id": "R-UEBERFUEHRT",
      "wenn": [
        "schluesselbeweis",
        "fundort"
      ],
      "folge": "ueberfuehrt",
      "text": "Ein Schlüsselbeweis überführt eine Person, wenn auch Herrn Schneiders Schlüsselbund an ihrem Versteck gefunden ist. Alle anderen scheiden aus."
    }
  ],
  "fakten": [
    {
      "id": "f_alibi_ahmet",
      "typ": "alibi",
      "personen": [
        "ahmet"
      ],
      "quelle": {
        "beobachtung": "b_damir_ahmet_blieb"
      }
    },
    {
      "id": "f_spaet_ahmet",
      "typ": "spaetankunft",
      "personen": [
        "ahmet"
      ],
      "quelle": {
        "beobachtung": "b_damir_ahmet_weg"
      }
    },
    {
      "id": "f_alibi_fatma",
      "typ": "alibi",
      "personen": [
        "fatma"
      ],
      "quelle": {
        "beobachtung": "b_emine_fatma_frueh"
      }
    },
    {
      "id": "f_spaet_fatma",
      "typ": "spaetankunft",
      "personen": [
        "fatma"
      ],
      "quelle": {
        "beobachtung": "b_emine_fatma_spaet"
      }
    },
    {
      "id": "f_alibi_olli",
      "typ": "alibi",
      "personen": [
        "olli"
      ],
      "quelle": {
        "beobachtung": "b_azra_olli_frueh"
      }
    },
    {
      "id": "f_spaet_olli",
      "typ": "spaetankunft",
      "personen": [
        "olli"
      ],
      "quelle": {
        "beobachtung": "b_azra_olli_spaet"
      }
    },
    {
      "id": "f_foto_streit",
      "typ": "motiv",
      "personen": [
        "ahmet"
      ],
      "quelle": {
        "spur": "spur_foto_streit"
      }
    },
    {
      "id": "f_notiz_fehlende",
      "typ": "luege",
      "personen": [
        "fatma",
        "olli"
      ],
      "quelle": {
        "spur": "spur_notiz_fehlende"
      }
    },
    {
      "id": "f_kurzschluss",
      "typ": "ausgangslage",
      "personen": [],
      "quelle": {
        "beobachtung": "b_tim_kurzschluss"
      }
    },
    {
      "id": "f_nd_ahmet_umschlag",
      "typ": "nebendelikt",
      "personen": [
        "ahmet"
      ],
      "quelle": {
        "spur": "spur_umschlag_aufschrift"
      }
    },
    {
      "id": "f_z_ahmet",
      "typ": "zusatzindiz",
      "personen": [
        "ahmet"
      ],
      "quelle": {
        "spur": "spur_umschlag_wachs"
      }
    },
    {
      "id": "f_nd_can_maske",
      "typ": "nebendelikt",
      "personen": [
        "can"
      ],
      "quelle": {
        "spur": "spur_maske_da"
      }
    },
    {
      "id": "f_z_can",
      "typ": "zusatzindiz",
      "personen": [
        "can"
      ],
      "quelle": {
        "spur": "spur_maske_wachs"
      }
    },
    {
      "id": "f_nd_fatma",
      "typ": "nebendelikt",
      "personen": [
        "fatma"
      ],
      "quelle": {
        "spur": "spur_schatulle_da"
      }
    },
    {
      "id": "f_z_fatma",
      "typ": "zusatzindiz",
      "personen": [
        "fatma"
      ],
      "quelle": {
        "spur": "spur_schatulle_wachs"
      }
    },
    {
      "id": "f_vitrine_leer",
      "typ": "umgebung",
      "personen": [],
      "quelle": {
        "spur": "spur_vitrine_leer"
      }
    },
    {
      "id": "f_nd_olli",
      "typ": "nebendelikt",
      "personen": [
        "olli"
      ],
      "quelle": {
        "spur": "spur_weste_moebelwachs"
      }
    },
    {
      "id": "f_z_olli",
      "typ": "zusatzindiz",
      "personen": [
        "olli"
      ],
      "quelle": {
        "spur": "spur_weste_kerzenwachs"
      }
    },
    {
      "id": "f_handschuh_kamin",
      "typ": "umgebung",
      "personen": [],
      "quelle": {
        "spur": "spur_handschuh_russ"
      }
    },
    {
      "id": "f_fundort_ahmet",
      "typ": "fundort",
      "personen": [
        "ahmet"
      ],
      "quelle": {
        "spur": "spur_jacke_bund"
      }
    },
    {
      "id": "f_fundort_fatma",
      "typ": "fundort",
      "personen": [
        "fatma"
      ],
      "quelle": {
        "spur": "spur_brottasche_bund"
      }
    },
    {
      "id": "f_fundort_olli",
      "typ": "fundort",
      "personen": [
        "olli"
      ],
      "quelle": {
        "spur": "spur_eiskuebel_bund"
      }
    },
    {
      "id": "f_fundort_can",
      "typ": "fundort",
      "personen": [
        "can"
      ],
      "quelle": {
        "spur": "spur_helm_bund"
      }
    },
    {
      "id": "f_staender_verbogen",
      "typ": "umgebung",
      "personen": [],
      "quelle": {
        "spur": "spur_staender_verbogen"
      }
    },
    {
      "id": "f_k_ahmet",
      "typ": "schluesselbeweis",
      "personen": [
        "ahmet"
      ],
      "quelle": {
        "spur": "spur_griff_papier"
      }
    },
    {
      "id": "f_k_can",
      "typ": "schluesselbeweis",
      "personen": [
        "can"
      ],
      "quelle": {
        "spur": "spur_griff_leuchtfarbe"
      }
    },
    {
      "id": "f_k_olli",
      "typ": "schluesselbeweis",
      "personen": [
        "olli"
      ],
      "quelle": {
        "spur": "spur_fuss_splitter"
      }
    },
    {
      "id": "f_k_fatma",
      "typ": "schluesselbeweis",
      "personen": [
        "fatma"
      ],
      "quelle": {
        "spur": "spur_ring_messing"
      }
    },
    {
      "id": "f_nd_can_zeynep",
      "typ": "nebendelikt",
      "personen": [
        "can"
      ],
      "quelle": {
        "beobachtung": "b_zeynep_vorrat"
      }
    },
    {
      "id": "f_nd_ahmet_quittung",
      "typ": "nebendelikt",
      "personen": [
        "ahmet"
      ],
      "quelle": {
        "spur": "spur_quittung"
      }
    }
  ],
  "entscheidungen": [
    {
      "id": "e1_1",
      "runde": 1,
      "nr": 1,
      "art": "person",
      "frage": "Wer weiß, wer im Dunkeln am Ostende der Theke war?",
      "optionen": [
        {
          "id": "e1_1_joanna",
          "ziel": {
            "person": "johanna"
          },
          "text": "Joanna befragen",
          "fakten": [
            "f_foto_streit"
          ]
        },
        {
          "id": "e1_1_damir",
          "ziel": {
            "person": "enes"
          },
          "text": "Damir befragen",
          "fakten": [
            "f_alibi_ahmet",
            "f_spaet_ahmet"
          ]
        }
      ],
      "richtig": {
        "ahmet": "e1_1_damir",
        "fatma": "e1_1_damir",
        "olli": "e1_1_damir",
        "can": "e1_1_damir"
      },
      "begruendung": {
        "alle": {
          "kette": [
            "beobachtung:b_damir_an_der_theke",
            "beobachtung:b_detektiv_gehoert"
          ],
          "text": "Damir stand um 23:57 an der Theke, wo es gescheppert hat. Wer dort im Dunkeln kauerte, weiß, wer beim Scheppern wo war. Joannas Foto zeigt nur einen Streit vor dem Ausfall."
        }
      }
    },
    {
      "id": "e1_2",
      "runde": 1,
      "nr": 2,
      "art": "person",
      "frage": "Wer war im Dunkeln am linken Buffettisch?",
      "optionen": [
        {
          "id": "e1_2_emine",
          "ziel": {
            "person": "emine"
          },
          "text": "Emine befragen",
          "fakten": [
            "f_alibi_fatma",
            "f_spaet_fatma"
          ]
        },
        {
          "id": "e1_2_tugba",
          "ziel": {
            "person": "tugba"
          },
          "text": "Tugba nach ihrem Notizbuch fragen",
          "fakten": [
            "f_notiz_fehlende"
          ]
        }
      ],
      "richtig": {
        "ahmet": "e1_2_emine",
        "fatma": "e1_2_emine",
        "olli": "e1_2_emine",
        "can": "e1_2_emine"
      },
      "begruendung": {
        "alle": {
          "kette": [
            "beobachtung:b_emine_versteck",
            "beobachtung:b_detektiv_gehoert"
          ],
          "text": "Emine duckte sich beim Knall hinter den linken Buffettisch, wenige Schritte von der Theke. Sie weiß, wer neben ihr kauerte. Tugbas Notizbuch zeigt nur, was die Leute über sich behaupten."
        }
      }
    },
    {
      "id": "e1_3",
      "runde": 1,
      "nr": 3,
      "art": "person",
      "frage": "Wer war im Dunkeln am rechten Buffettisch?",
      "optionen": [
        {
          "id": "e1_3_tim",
          "ziel": {
            "person": "tim"
          },
          "text": "Tim zum Stromausfall befragen",
          "fakten": [
            "f_kurzschluss"
          ]
        },
        {
          "id": "e1_3_azra",
          "ziel": {
            "person": "dilara"
          },
          "text": "Azra befragen",
          "fakten": [
            "f_alibi_olli",
            "f_spaet_olli"
          ]
        }
      ],
      "richtig": {
        "ahmet": "e1_3_azra",
        "fatma": "e1_3_azra",
        "olli": "e1_3_azra",
        "can": "e1_3_azra"
      },
      "begruendung": {
        "alle": {
          "kette": [
            "beobachtung:b_azra_versteck",
            "beobachtung:b_detektiv_gehoert"
          ],
          "text": "Azra duckte sich beim Knall am rechten Buffettisch, nahe der Theke. Sie weiß, wer neben ihr kauerte. Tim weiß nur, warum der Strom ausfiel."
        }
      }
    },
    {
      "id": "e2_1",
      "runde": 2,
      "nr": 1,
      "art": "gegenstand",
      "frage": "Wessen Heimlichtuerei klärst du jetzt?",
      "optionen": [
        {
          "id": "e2_1_ascheneimer",
          "ziel": {